method,cluster_id,size,avg_frequency,median_frequency,recipe_coherence,density_coherence,coverage_coherence,quality,interpretation,primary_category,category_match_pct,secondary_category,recipes_with_cluster,max_co_occurrence,top_5_ingredients,top_10_ingredients
HDBSCAN,9,19,791.8947368421053,9.0,152.73684210526315,2.394555478980014,12.60292357357902,MEDIUM,MODERATELY COHERENT - meaningful grouping,mixed,15.789473684210526,,2902,6,"ground cinnamon, ground nutmeg, ground cloves, ground allspice, ground cardamom","ground cinnamon, ground nutmeg, ground cloves, ground allspice, ground cardamom, pumpkin puree, canned pumpkin, cooked pumpkin, instant tea, instant tea powder"
HDBSCAN,6,90,538.4222222222222,200.0,117.05555555555556,2.6034171808258186,2.892685756473132,MEDIUM,MODERATELY COHERENT - meaningful grouping,italian,33.33333333333333,vegetables,10535,10,"parmesan cheese, mozzarella cheese, ricotta cheese, pasta sauce, crushed tomatoes","parmesan cheese, mozzarella cheese, ricotta cheese, pasta sauce, crushed tomatoes, spaghetti, roma tomato, pasta, italian sausage, roasted red pepper"
HDBSCAN,21,62,462.0483870967742,212.0,107.12903225806451,2.547726588376995,4.109236432866121,MEDIUM,MODERATELY COHERENT - meaningful grouping,mexican,35.483870967741936,,6642,7,"salsa, monterey jack cheese, jalapeno pepper, jalapeno, flour tortilla","salsa, monterey jack cheese, jalapeno pepper, jalapeno, flour tortilla, taco seasoning, kidney bean, corn tortilla, tortilla chips, frozen corn"
HDBSCAN,13,24,582.875,314.0,103.95833333333333,2.3559118236472947,9.816299265197062,MEDIUM,MODERATELY COHERENT - meaningful grouping,grains,50.0,baking,2495,6,"whole wheat flour, rolled oats, oats, oatmeal, splenda sugar substitute","whole wheat flour, rolled oats, oats, oatmeal, splenda sugar substitute, unsweetened applesauce, white flour, splenda granular, flax seed, wheat germ"
HDBSCAN,11,27,339.44444444444446,134.0,99.48148148148148,2.3406552494415487,8.66909351645018,MEDIUM,MODERATELY COHERENT - meaningful grouping,baking,59.25925925925925,grains,2686,6,"dry yeast, warm water, bread flour, yeast, powdered milk","dry yeast, warm water, bread flour, yeast, powdered milk, nonfat dry milk powder, instant yeast, fast rise yeast, rye flour, yeast bread dough"
HDBSCAN,4,33,515.3030303030303,89.0,85.48484848484848,2.2764976958525347,6.898477866219801,MEDIUM,MODERATELY COHERENT - meaningful grouping,condiments,21.21212121212121,grains,2821,6,"worcestershire sauce, ketchup, prepared mustard, yellow mustard, liquid smoke","worcestershire sauce, ketchup, prepared mustard, yellow mustard, liquid smoke, catsup, mustard powder, ground mustard, steak sauce, countrystyle pork ribs"
HDBSCAN,18,53,318.37735849056605,145.0,82.77358490566037,2.6099840437656714,4.9244981957842855,MEDIUM,MODERATELY COHERENT - meaningful grouping,asian,28.30188679245283,condiments,4387,9,"sesame oil, rice vinegar, fish sauce, rice wine vinegar, hoisin sauce","sesame oil, rice vinegar, fish sauce, rice wine vinegar, hoisin sauce, bean sprouts, oyster sauce, snow peas, lemongrass, toasted sesame seeds"
HDBSCAN,3,38,476.6578947368421,71.0,77.13157894736842,2.3125213237802797,6.085582431000736,MEDIUM,MODERATELY COHERENT - meaningful grouping,seafood,23.684210526315788,,2931,7,"mayonnaise, mustard, hardboiled egg, tuna, lettuce leaf","mayonnaise, mustard, hardboiled egg, tuna, lettuce leaf, hamburger bun, crabmeat, dill pickle, pickle relish, imitation crabmeat"
HDBSCAN,22,20,444.65,295.0,51.45,2.1243926141885328,10.621963070942664,MEDIUM,MODERATELY COHERENT - meaningful grouping,dessert,55.00000000000001,baking,1029,4,"cocoa powder, unsweetened cocoa powder, semisweet chocolate, graham cracker crumbs, bitter chocolate","cocoa powder, unsweetened cocoa powder, semisweet chocolate, graham cracker crumbs, bitter chocolate, dark chocolate, white chocolate, cherry pie filling, chocolate, oreo cookies"
HDBSCAN,17,32,222.4375,68.0,45.90625,3.0381211708645335,9.494128658951666,HIGH,HIGHLY COHERENT - strong culinary relationship,indian,25.0,baking,1469,10,"cumin seed, mustard seeds, garam masala, coriander leaves, coriander seed","cumin seed, mustard seeds, garam masala, coriander leaves, coriander seed, red chili powder, turmeric powder, coriander powder, ghee, cardamom pod"
HDBSCAN,14,21,413.8095238095238,124.0,42.857142857142854,2.183333333333333,10.396825396825395,MEDIUM,MODERATELY COHERENT - meaningful grouping,dessert,33.33333333333333,dairy,900,5,"semisweet chocolate chips, chocolate chips, dark chocolate chips, butterscotch chips, rice krispies","semisweet chocolate chips, chocolate chips, dark chocolate chips, butterscotch chips, rice krispies, salted peanuts, crunchy peanut butter, crisp rice cereal, peanut butter chips, toffee pieces"
HDBSCAN,23,184,148.72282608695653,2.0,28.293478260869566,2.3232808298117558,1.2626526248976933,MEDIUM,MODERATELY COHERENT - meaningful grouping,fruits,26.6304347826087,,5206,10,"lime juice, orange juice, banana, orange zest, ice cube","lime juice, orange juice, banana, orange zest, ice cube, ice, orange rind, lime zest, frozen strawberries, tequila"
HDBSCAN,5,16,347.375,125.0,18.9375,2.0858085808580857,13.036303630363037,MEDIUM,MODERATELY COHERENT - meaningful grouping,mixed,12.5,,303,3,"baby spinach, romaine lettuce, goat cheese, green salad, arugula","baby spinach, romaine lettuce, goat cheese, green salad, arugula, sherry vinegar, mixed greens, redleaf lettuce, butter lettuce, radicchio"
HDBSCAN,1,24,248.58333333333334,1.0,18.583333333333332,2.013452914798206,8.389387144992526,MEDIUM,MODERATELY COHERENT - meaningful grouping,baking,33.33333333333333,,446,3,"egg white, cream of tartar, diet soda, reducedfat oreo cookies, cherry extract","egg white, cream of tartar, diet soda, reducedfat oreo cookies, cherry extract, violets, sponge cake fingers, red gelatin, reducedfat white cake mix, glutenfree graham cracker crumbs"
HDBSCAN,24,38,162.71052631578948,1.5,13.31578947368421,2.2114624505928853,5.819638027876014,MEDIUM,MODERATELY COHERENT - meaningful grouping,dessert,26.31578947368421,dairy,506,5,"whipped cream, kahlua, baileys irish cream, espresso, coffee liqueur","whipped cream, kahlua, baileys irish cream, espresso, coffee liqueur, creme de cacao, chocolate ice cream, irish cream, chocolate shavings, chocolate curls"
HDBSCAN,16,23,128.2608695652174,50.0,6.217391304347826,2.041958041958042,8.878078443295836,MEDIUM,MODERATELY COHERENT - meaningful grouping,baking,60.86956521739131,dessert,143,4,"yellow cake mix, cake mix, chocolate cake mix, devils food cake mix, brownie mix","yellow cake mix, cake mix, chocolate cake mix, devils food cake mix, brownie mix, lemon cake mix, chocolate frosting, vanilla frosting, fudge brownie mix, german chocolate cake mix"
HDBSCAN,2,16,546.0,1.5,2.3125,2.0,12.5,LOW,WEAK COHERENCE - potential artifact,dairy,37.5,italian,37,2,"skinless chicken breast, shakenbake, barbecue potato chips, chicken coating mix, lowcarb milk","skinless chicken breast, shakenbake, barbecue potato chips, chicken coating mix, lowcarb milk, fatfree balsamic vinegar, frozen mozzarella garlic bread, simply potatoes steakhouse seasoned diced potatoes, alfredo noodles mix, campbells condensed creamy verde soup"
HDBSCAN,0,16,291.6875,1.0,1.1875,2.0,12.5,LOW,WEAK COHERENCE - potential artifact,vegetables,25.0,condiments,19,2,"mushroom, dove breasts, fat free hollandaise mix, fat free vegetable soup, lowfat pepperoni","mushroom, dove breasts, fat free hollandaise mix, fat free vegetable soup, lowfat pepperoni, tomato sauce with herbs, vegit seasoning, boneless duck leg, bonito tuna, chicken broth soup"
HDBSCAN,7,22,430.27272727272725,1.0,1.1363636363636365,2.0,9.090909090909092,LOW,WEAK COHERENCE - potential artifact,mixed,18.181818181818183,beverages,25,2,"honey, dried peppermint, yogurt starter, brewed hibiscus tea, geranium leaf","honey, dried peppermint, yogurt starter, brewed hibiscus tea, geranium leaf, argan oil, bacon cheddar cheese, camomile tea bags, candied apricots, chocolate spread"
HDBSCAN,20,29,859.0689655172414,1.0,1.0344827586206897,2.1,7.241379310344828,MEDIUM,MODERATELY COHERENT - meaningful grouping,dessert,24.137931034482758,beverages,30,3,"milk, banana syrup, basil seeds, gingerbreadflavored syrup, macadamia syrup","milk, banana syrup, basil seeds, gingerbreadflavored syrup, macadamia syrup, bubblegum, caramel pudding mix, carbonated chocolate soda, cherry kijafa wine, chocolate flavored coffee"
HDBSCAN,8,15,767.4666666666667,1.0,1.0,2.1333333333333333,14.222222222222221,MEDIUM,MODERATELY COHERENT - meaningful grouping,beverages,26.666666666666668,baking,15,3,"vanilla extract, diet root beer, powdered fat free nondairy coffee creamer, reduced sugar devils food cake mix, fat free coffeemate","vanilla extract, diet root beer, powdered fat free nondairy coffee creamer, reduced sugar devils food cake mix, fat free coffeemate, kudzu, melba sauce, coffeeflavor soymilk, confectioners coating, earth balance shortening"
HDBSCAN,19,38,881.2105263157895,1.0,0.8947368421052632,2.0,5.263157894736842,LOW,WEAK COHERENCE - potential artifact,beverages,21.052631578947366,fruits,34,2,"water, koolaid, cherry powdered drink mix, cherry up, lychee syrup","water, koolaid, cherry powdered drink mix, cherry up, lychee syrup, chocolate ripple ice cream, creme de menthe coffee syrup, fatfree cookies, gummy fish, ice wine"
HDBSCAN,15,20,486.25,2.0,0.85,2.2941176470588234,11.470588235294118,MEDIUM,MODERATELY COHERENT - meaningful grouping,mixed,15.0,,17,4,"oil, tootsie roll, clear creme de menthe, funsize milky way bar, jello chocolate instant pudding","oil, tootsie roll, clear creme de menthe, funsize milky way bar, jello chocolate instant pudding, licorice whips, new kitty litter box, onion skins, pink vanilla funfetti frosting, planters sliced almonds"
HDBSCAN,10,18,248.94444444444446,1.0,0.8333333333333334,2.3333333333333335,12.962962962962965,MEDIUM,MODERATELY COHERENT - meaningful grouping,mixed,11.11111111111111,,15,6,"raisins, fruit snacks, caramel corn, gummy bears, kremelta","raisins, fruit snacks, caramel corn, gummy bears, kremelta, pretzel rings, sapodilla, ahmed brand vermicelli, barley nugget cereal, charoli nuts"
HDBSCAN,12,16,1.375,1.0,0.0,0.0,0.0,LOW,WEAK COHERENCE - potential artifact,dessert,37.5,dairy,0,0,"peanut butter captain crunch cereal, caramel squares, lucky charms cereal, candy coated chocolate eggs, candy pumpkins","peanut butter captain crunch cereal, caramel squares, lucky charms cereal, candy coated chocolate eggs, candy pumpkins, danish fars meatballs, fruit puffs, hershey milk chocolate filled with caramel baking pieces, honey buns, jamon serrano"
